subreddit,title
0,robot encroach on up to  million job around the world 
0,measur in ai polici opportun and challeng 
0,how egypt is grow forest in middl of the desert 
0,energi scaveng nanogener find power all around us 
0,there are polit and cultur problem that occur with social chang in a societi with high andor rise life expect 
0,saudi arabia plan bn world largest green hydrogen plant to fuel global bu and truck fleet 
0,today’ elderli are healthier than a gener ago  lifespan news 
0,smart toilet could be the ultim health monitor devic 
0,energi scaveng nanogener find power all around us 
0,mit valid scienc behind new nuclear fusion reactor design 
0,thi hilari odd short film wa written by gpt  digit trend 
0,announc power materi move to daili format expand coverag 
0,no electr need oil compani repsol aim to turn solar straight into hydrogen 
0,radi cooler that cool down even under sunlight 
0,everywher basic incom ha been tri in one map 
0,the encrypt war is on again and thi time govern ha a new strategi 
0,got ani signal up here nokia to build mobil network on the moon 
0,postconsum recycl plastic market by polym type servic process type endus applic and region  global forecast to  
0,human will go back to farm when ai take our job do you agre 
0,sorri coal  convers effici eyebal for nextgen “hot carrler” perovskit solar cell 
0,molecular design strategi reveal near infraredabsorb hydrocarbon 
0,the next gener of power plant will be virtual  increas number of home outfit with solar panel and batteri have the potenti to help power entir region with renew energi 
0,can we trust ai doctor googl health and academ battl it out 
0,simul realiti 
0, hp ssc tuatara is now the world’ fastest product car 
0,ai design thi car 
0,the us govern plan to file antitrust charg against googl today 
0,an approach toward sustain live green build 
0,test plan for ‘nextgeneration’ freightlin cascadia equip with level  selfdriv tech 
0,who is lead the g patent race compani which have the most patent for g technolog 
0,china announc plan for a part reusabl space plane capabl of take crew to the chines space station 
0,prof jeff dahn dalhousi univers talk about how new lithium ion batteri longev can power vehicl up to  million km and will lead to vehicl to grid webinar 
0,where do you see data such as artifici intellig machin learn and other technolog innov  year from now 
0,can graphic content inform without the shockfactor a netflix arkangel vibe to thi 
0,what do you guy think 
0,new us fuel cell allianc blow dark green hydrogen cloud over natur ga a new manufactur allianc ha pop up in the us and it’ on a mission to replac diesel engin with fuel cell in truck — and buse aircraft watercraft offroad equip and locomot too 
0,are biologist abl to make a worm live forev yet if not whi can’t they if ye when will they be abl to do thi to us 
0,bill gate decemb  “i do think of basic knowledg of the scienc math skill econom — a lot of career in the futur will be veri demand on those things” how probabl is that 
0,are biologist abl to make a worm live forev yet if not whi can’t they if ye when will they be abl to do thi to us 
0,two molecul target mitochondria synergist improv age heart function 
0,the new space race is start to take shape china unveil ambiti lunar mission 
0,facebook new ai can translat languag directli into one anoth 
0,massiv demand for flippi the autom robot fastfood cook 
0,autom technolog allow unparallel space explor 
0,the central internet is inevit the dream of the decentr internet is dead but hope for a futur of unpreced flourish enabl by technolog is veri much aliv 
0,research use labgrown tissu graft for person joint replac 
0,the green hydrogen revolut is now underway the st centuri will like wit the rise of a megabillion hydrogen fuel industri 
0,nasa to build a g mobil network on the moon 
0,til that global oil demand wa  million barrel per day in septemb  it wa  million barrel per day in  call for peak oil demand are prematur 
0,medicin that defeat age have at least a  chanc of be develop within the next  year 
0,poland invest in  new nuclear power plant 
0,research from the indian institut of scienc iisc have develop a noninvas bandag made with magnet nanofibr to treat skin cancer by administ heat to the tumour cell 
0,solar breakthrough realis potenti of ‘miracl material’ forg in earth’ mantl 
0,five innov that could shape the futur of rail travel 
0,last week in ai news digest  inclus ai lessthanoneshot learn and more 
0,selfsovereignti via technolog or what to do about global 
0,soni  spatial realiti display  where imagin becom realiti 
0,got ani signal up here nokia to build mobil network on moon 
0,china unveil ambiti moon mission plan includ prepar for build a man intern lunar research station by the end of the decad 
0,artemi accord whi mani countri are refus to sign moon explor agreement 
0,the chip of the futur will includ programm photon circuit 
0,with implic for futur ai develop neuroscientist discov a molecular mechan that allow memori to form  modif to chromosom in “engram” neuron control the encod and retriev of memori 
0,philosoph ai  how do we creat a paradis on earth for all creatur and sentient entiti 
0,how doe ai work in your favourit game and whi doesnt the game commun use more advanc ai 
0,liquid metal come to the rescu of semiconductor overcom moore’ law with fastswitch ultralow energi electron 
0,tesla batteri research show new test result point to batteri last over  million mile 
0,new experi reveal whi humanlik robot creep us out 
0,factor affect the futur of travel and tourism postcovid 
0,with artifici intellig everi soldier is a counterdron oper 
0,artifici intellig and africa the case for invest in african telecom 
0,bia in artifici intellig is your bot bigot 
0,whi scoop an asteroid sampl is harder than it look 
0, compton resid to get guarante incom in twoyear pilot program 
0,im curiou what everyon want vr vs ar 
0,solar storag and wind — success stori in australia us and vietnam  there is a problem that haunt tradit mean of gener electr — it take year to design build and activ ani coal or ga power facil but renew — especi solar — can come onlin quickli 
0,you wake up in  what do you see 
0,spacex to launch it first uncrew mission to mar in  
0, strang fact about the interstellar visitor oumuamua first interstellar object discov in our solar system novemb  
0,do you believ edg comput is the futur structur of the internet 
0,india’ first hydrogen fuel cell electr hybrid car complet maiden test run in citi 
0,give these app some note and theyll write email for you 
0,are you optimist or pessimist 
0,classifi knot research creat optic frame knot to encod inform 
0,america largest solarpanel maker lead the world in panel recycling–recov  of materi the materi can recreat new panel for  year befor they final becom too unstabl to use again 
0,give these app some note and theyll write email for you  entrepreneur are build tool that creat email or market copi use gpt textgener technolog releas earlier thi year 
0,us energi   carbon free  
0,caltech develop a way to map brain circuit in real time 
0,a new ultrafast control scheme of ferromagnet for energyeffici data storag 
0,plasma base lighter then air ship 
0,negoti an intern astronomi treati to help reveal the hidden univers 
0,perfect energi effici quantum engin with entangl as fuel 
0,cruis will soon hit san francisco with no hand on the wheel 
0,if recycl plastic isn’t make sens remak the plastic use ironbas catalyst 
0,how egypt is grow forest in middl of the desert 
0,scientist use d print to reinforc concret with polym lattic creat more durabl build materi with a lower carbon footprint 
0,what would a wetwar supercomput look like 
0,sequest seawat on land a waterbas solut to global issu  articl 
0,a rectangular robot as tini as a few human hair can travel throughout a colon by do back flip engin have demonstr in live anim model backflip becaus the goal is to use the robot to transport drug in human whose colon and other organ have rough terrain side flip work too 
0,new solar panel design could increas their abil to absorb light by  
0,astronom report they’v detect the amino acid glycin in the atmospher of venu  which again hint to the presenc of life on the planet 
0,when did we becom fulli human what fossil and dna tell us about the evolut of modern intellig 
0,the next gener of artifici intellig  progress in the field sinc  ha been breathtak and relentless if anyth thi breakneck pace is onli acceler 
0,nokia win nasa contract to put a g network on the moon 
0,nasa artemi lunar spacesuit is go to be damn impress “the xemu ha been design from the veri begin to be safer and have fewer catastroph failur mode than ani of it predecessors” 
0,michio kaku talk with lex fridman on space travel alien and the futur of human 
0,insid gravity’ dare mission to make jetpack a realiti  inventor like richard brown have been tri to build jetpack for a centuri now they’r here what do we do with them 
0,million of microscop robot learn to walk  research invent leg that allow microscop robot smaller than the tip of hair to move guid by electr signal sent by human 
0,deseret news us award  billion to help build small reactor in idaho 
0,the next econom crisi empti retail space 
0,germani want to make remot work a legal right 
0,well find et with a molecul not a messag the grand discoveri of alien life is like to come in the form of frustratingli subtl chemic clue 
0,augment realiti must have augment privaci 
0,artifici gener intellig are we close and doe it even make sens to tri 
0,exoskeleton suit transform car factori worker into human robot 
0,what is the singl biggest advanc that will propel human into the futur 
0,pizzabot  which assembl a pizza in under  minut 
0,war of the s and s 
0,elon musk guess spacex could send it nextgen starship to mar as soon as  
0,whi there is hope that the world coral reef can be save with the futur of the world’ ecolog and human system now so deepli interconnect a new movement in reef conserv is put social system at it heart 
0,new smallest time measur how long it take a photon to cross a hydrogen molecul thi is the shortest timespan that ha ever been measur and amount to about  zeptosecond a trillionth of a billionth of a second or  second  
0,ultrahighperform concret is readi to revolution precast prestress concret april  
0,how readi player one could becom realiti 
0,impati a spacecraft could get to titan in onli  year use a direct fusion drive  univers today 
0,attempt to open a dialogu on view world harmoni as a solvabl problem with logic step 
0,terraform map of terrestri planet  playlist with differ project and percentag of water surfac 
0,ai that can solv bandwidth problem for video call nvidia maxin 
0,role of artifici intellig in cyber secur 
0,depart of energi pick two advanc nuclear reactor for demonstr project  scienc  aaa 
0,scientist with al dr peter scottmorgan set to becom world veri first full cyborg 
0,in the futur whether privat own or share car will becom an extens of our home the live room of the futur tesla is alreadi head in thi direct by incorpor entertain secur and autonomi in their vehicl 
0,nasa’ roman space telescop will unveil undiscov planet 
0,how mani human job do robot realli replac mit economist daron acemoglu’ new research say it  
0,china want to lead the creation of global standard in blockchain tech and launch china standard  initi 
0,thi dutch offshor wind farm will help oyster reef grow 
0,we face a grow array of problem that involv technolog nuclear weapon data privaci concern use botsfak news to influenc elect howev these are in a sens not sever problem they are facet of a singl problem the grow gap between our power and our wisdom 
0,thi week’ awesom tech stori from around the web through octob  
0,our comfort is what is current drive our speci to the brink of extinct it is the part of us that eckhart toll call the prison of the conceptu mind the premis for thi video is that in see thi there is liber and hope for futur gener 
0,four ride in a fulli selfdriv car  with no safeti driver up front 
0,behind anduril’ effort to creat an oper system for war 
0,china’ bn scheme to transmit solar power from tibet china is plan to build the world’ largest super grid by connect the countri six region power grid and transmit electr from renew resourc in the west to the east where most of the demand is 
0,elon musk say the sun can power all of civil of cours he right 
0,the great unravel i never thought i’d live to see the horror of planetari collaps 
0,how a memori quirk of the human brain can galvan ai 
0,‘the social dilemma’ will freak you out—but there more to the stori 
0,scientist found a new way to control the brain with light—no surgeri requir 
0,these robot virtual realiti boot make it feel like your walk while you stay in place 
0,the biggest problem we face are social not technolog 
0,oregon citi gener renew energi from underground water pipelin pioneer a new technolog for water util the inprv from inpip energi that convert excess water pressur into carbonfre electr 
0,malaysia railway compani ktmb test smart helmet to detect passeng with covid symptom 
0,nt neuroscientist discov a molecular mechan that allow memori to form neurosci biweekli vol  rd octob — th octob 
0,how to be prepar for the chang come  g 
0,a rectangular robot as tini as a few human hair can travel throughout a colon by do back flip engin have demonstr in live anim model backflip becaus the goal is to use the robot to transport drug in human whose colon and other organ have rough terrain side flip work too 
0,thi arkansa school turn solar save into better teacher pay  in three year gener enough save to transform the district’  budget deficit into a  million surplu  fuel pay rais that averag between  and  per educ 
0,chines test suicid drone swarm thi won’t end well 
0,i think the great depress  is come soon 
0,nasa award  million to privat compani to aid moon explor push 
0,the futur of the us coast guard is in outer space 
0,a reflect on artifici intellig singular 
0,ststw s ep  how can scienc help reduc nois pollut 
0,astronom report that venu atmospher contain an amino acid found in dna 
0,elon musk will share hi latest moon and mar plan with all earthl friday 
0,ai design thi car 
0,a radic new techniqu let ai learn with practic no data  “less than one”shot learn can teach a model to identifi more object than the number of exampl it is train on 
0,what are busi idea that could chang the world or just idea in gener 
0,nokia secur m nasa fund to roll out g on the moon 
0,new research could help million who suffer from ring in the ear 
0,remot work in europ  
0,first room temperatur superconductor  exclus interview 
0,the grim fate that could be ‘wors than extinction’ 
0,addit manufactur clb support the bluegreen team with d print technolog 
0,layercak d superconduct develop clean d superconduct in a bulk van der waal superlattic 
0,explain and trustworthi artifici intellig for correct model in chemic scienc 
0,artifici intellig cold war on the horizon 
0,heat is the humanright issu of the st centuri  the world is get hotter and the divid between rich and poor is get bigger 
0,nasa’ about to tri grab a chunk of asteroid to bring to earth—and you can watch 
0,fast enough to see light travel ultrafast camera film d movi at  billion frame per second 
0,the threat of killer robot is real and closer than you might think 
0,gpower autom will transform work for the better 
0,smoothiemak robot whip up drink at california walmart  digit trend 
0,applic of neurotech in exot field  dr david eagleman dr pia tikka dr isabella pasqualini dr max newton dr shiker chudhari dr navin gupta 
0,smart prison teach ai vr and digit skill  pia puolakka forens psychologist and project manag smart prison project crimin sanction agenc finland 
0,the us is back hydrogen truck with a new  million initi  us depart of energi unveil a brand new fiveyear  million plan to start phase diesel out of the market for longhaul transport with a strategi base on the implement of hydrogen fuel cell 
0,gm to run robot car in san francisco without human backup 
0,the hydrogen boom will provid a b boost to wind and solar energi bac say we have reach the tip point of har thi element effect and econom and predict the hydrogen marketplac to reach a stagger  trillion by  
0,‘machin set loos to slaughter’ the danger rise of militari ai 
0,the hydrogen boom will provid a b boost to wind and solar energi 
0,in a battl of ai versu ai research are prepar for the come wave of deepfak propaganda 
0,nvidia will suppli hardwar for leonardo a exaflop supercomput 
0,crispr and  and me 
0,is wind power’ futur in deep water  hywind project locat in more than ft m of water is that the giant mast and turbin sit in buoyant concreteandsteel keel that enabl them to stand upright on the water much like a fish buoy 
0,the state of deepfak in  develop disinform and detect 
0,i never saw star befor gene therapi bring back yearold canadian boy sight he is the first canadian to be treat with gene replac therapi for a rare form of blind which had left sam unabl to see sky on a cloudi day  
0,aileg tech master’ thesi  companiesinstitut 🤖📝 
0,new experi show how to get energi from a black hole 
0,cut edg technolog not yet use in canada solv murder of young girl date back to  
0,vote specul 
0,last week in ai news  gpt on reddit facial recognit in argentina stat on big tech fund ai academia 
0,jeff bezo rocket compani launch first test of it tourism spaceship in a year 
0,what scifi book most accur predict the world we live in today 
0,cruis get the green light to test fulli driverless car in california  the compani say it will begin test it driverless vehicl befor the end of the year 
0,thi new wind turbin har the power of traffic 
0,cruis receiv a permit from the california dmv to remov the human backup driver from their selfdriv car they’r go to be the first to put thi permit to use on the street of a major us citi 
0,purdu univers research demonstr how their allterrain microrobot climb through a mous colon 
0,how commerci the intern space station can help astronaut get to the moon and mar 
0,believ it or not autonom vehicl are here 
0,pew analysi of the cultur war around fast chang winner and loser 
0,hr solar energi capston turbin nasdaqcpst announc success demonstr of one of the world most versatil zerocarbon energi solut 
0,torc to scale selfdriv fleet with dtna test truck in earli  
0,‘machin set loos to slaughter’ the danger rise of militari ai  news 
0,feed cow charcoal to absorb methan ga and improv water retent in soil 
0,airbreath rocket engin the futur of space flight 
0,solo singleseat electr vehicl hit the street in la about  percent of peopl who travel by car truck van or motorcycl drive alon accord to the us censu bureau 
0,estonia is a ‘digit republic’—what that mean and whi it may be everyone’ futur 
0,first hydrogen mechan doubl decker bu to run in the world 
0,artifici intellig and digit twin 
0,an overview of longev live to  and beyond 
0,ai’ struggl to reach “understanding” and “meaning” 
0,germani draft law to give peopl the legal right to work from home 
0,superconductor technolog for smaller sooner fusion  if were success in what were do and in other technolog fusion energi will start to make a differ in mitig climat change—not in  year but in  year 
0,solar is now ‘cheapest electr in history’ confirm iea  the world’ best solar power scheme now offer the “cheapest…electr in history” with the technolog cheaper than coal and ga in most major countri 
0,gpt wrote thi film 
0,deep fake are fake news mayb real 
0,virtual puppet promis glitchfre video call 
0,nasa new transform rover can explor steep cliff on mar  the spunki bot is design to one day explor some of the toughest terrain on the moon mar and beyond 
0,robot dolphin  which could be the end of captiv anim at theme park 
0,ubi the math librari of the futur a peski secur vuner and the impend explos of the ad tech bubbl  articl on issu that are bound to have a strong impact on the world of tomorrow 
0,the robot dolphin that could replac captiv anim at theme park one day  you cannot tell the differ 
0,denni e taylor did a podcast interview he wrote a seri of book about self replic von neumann space probe it is a fantast seri of book call the bobivers seri he a softwar engin that decid he could write scifi  and did great interview 
0,musk spacex starlink internet servic will work in highspe move vehicl 
0,everi wast product should be attach to buyer id so peopl get fine for litter ofc it need to be harder to misidentifi the wast 
0,what come next for capacitor 
0,integr hydrogen sensorsepar modul boost longterm effici and revenu in solar power plant 
0,former facebook execut say social media giant are ‘threat to democracy’ 
0,a new model of the brain’ reallif neural network  a new comput model predict how inform deep insid the brain could flow from one network to anoth and how neural network cluster can self optim over time 
0,scientist just discov the fastest possibl speed of sound 
0,how robot made thi food commerci look effortless 
0,novel quantum circuit calcul fourier transform faster and more effici 
0,lightweight bendi cheaper – the promis of organ solar panel 
0,the soviet union attempt a futurist project to creat a plan economi run by machin and had the mean to do so 
0,first roomtemperatur superconductor report 
0,after decad room temperatur superconduct achiev 
0,simul graviti with rotat acceler  experienti differ 
0,research unveil roadmap for a carbon neutral china by  
0,senat brown unveil discuss draft of comprehens privaci bill 
0,superconductor cabl technolog for smaller sooner fusion 
0,the danger of cynic scifi disast stori i’m chang how i write fiction—for the benefit of the real world cori doctorow 
0,live facial recognit is track kid suspect of be crimin in bueno air the first known system of it kind is hunt down minor who appear in a nation databas of alleg offend 
0,tori bruno ceo unit launch allianc lay out hi vision for a strateg propel reserv call for storag of liquid hydrogen and oxygen at depot between the earth and moon thi would enabl sustain inspac transport 
0,physicist discov room temperatur superconductor at extrem high pressur 
0,new mit solarpow system effici extract drinkabl water from “dry” air 
0,thi transform rover can explor the toughest terrain 
0,alphabet’ new moonshot is to transform how we grow food 
0,merced benz electrif plan more electr amg 
0,is wind power’ futur in deep water 
0,robot swarm follow instruct to creat art 
0,remov thi ✂️ aibas video complet is amaz 
0,develop largescal hydrogen fuel cell suit to ship thi project will develop a compact lightweight and highpow kw class standard modul of a pure hydrogen fuel cell it will be design for use by vessel railroad vehicl construct machineri  
0,deep learn artifici intellig keep an eye on volcano movement 
0,space mine should be a global project—but it’ not start off that way 
0,solar expect to dethron coal becom ‘new king of electricity’ global forecast find 
0,scientist found a new way to control the brain with light—no surgeri requir 
0,a fifth of countri worldwid at risk from ecosystem collaps as biodivers declin reveal pioneer swiss re index   of global gdp depend on highfunct biodivers and ecosystem servic 
0,research from korea creat a new type of face mask mascreen augment speech with visual cue of lip motion facial express and text use a wearabl display to appear in siggraph asia  emerg technolog 
0,do we live in a simul chanc are about –  gaug whether or not we dwell insid someon else’ comput may come down to advanc ai research—or measur at the frontier of cosmolog 
0,insid the strang new world of be a deepfak actor  there’ an art to be a perform whose face will never be seen 
0,fact fake and figur how ai is influenc journal 
0,multist data storag leav binari behind 
0,research extract more energi from sunlight – could boost the effici of solar panel by  a new studi show that by use a precis control fabric process research can produc multilay solar panel with the potenti to be  time more effici than tradit silicon 
0,liquid metal come to the rescu of semiconductor 
0,do the past and futur exist 
0,trafficpow wind turbin ha retrofit design to it can attach to exist street light 
0,robot might take over an essenti human form of express  the multirobot team can be thought of as an activ brush for the human artist to paint with where the individu robot the bristl move over the canva accord to the color specif provid by the human 
0,harvard professor want to slow down  revers age david sinclair approach for a longer life  minut video 
0,the futur of code is no code platform 
0,machinelearn techniqu from sandia lab could improv fusion energi output 
0,new design molten salt reactor is cheaper to run consum nuclear wast 
0,splitsecond ‘phantom’ imag can fool tesla’ autopilot  research found they could stop a tesla by flash a few frame of a stop sign for less than half a second on an internetconnect billboard 
0,an intern research team ha develop a new artifici intellig system base on the brain of tini anim such as threadworm thi novel aisystem can control a vehicl with just a few artifici neuron 
0,ben goertzel  agi gpt understand  mean gener 
0,the socialist futur 
0,plastic bag more ecofriendli than paper and cotton bag in countri like singapor ntu studi 
0,employe are choos robot over human to share their mental state 
0,float solar pv plant on hydropow reservoir could produc  twh of potenti power a year global nrel find 
0,solar energi reach histor low cost 
