subreddit,title
1,a team of scientist have describ the earliest around  million year ago known exampl of dentari bone with two row of cusp on molar and doubleroot teeth the new find offer insight into mammal tooth evolut particularli the develop of doubleroot teeth 
1,the first report case of the rare mitochondri haplotyp ha in ancient egypt 
1,a crosscountri databas of covid test 
1,new blood test predict which covid patient will develop sever infect 
1,magnitud demograph and dynam of the effect of the first wave of the covid pandem on allcaus mortal in  industri countri 
1,mental account is impact sustain behavior unig psychologist are analys the way our mind plan the use of resourc so that intervent can be develop to reduc excess energi consumpt and carbon emiss 
1,empathi prevent covid spread the more empathet we are the more like it is that we will keep our distanc and use face mask to prevent coronaviru spread thi knowledg can help save live accord to the research behind a new studi 
1,effect of veget on the spatial and tempor variat of microclim in the urban salt lake valley 
1,studi analyz effect of bodi imag on sexual activ in hookup cultur find that posit bodi imag wa correl to increas pleasur dure sex and neg perceiv bodi imag wa correl to sexual malfunct 
1,first confirm case of covid reinfect in us 
1,smartphon app that tell commut when a bu will arriv at a stop don’t result in less time wait than just use the offici bu rout schedul a new studi done in columbu ohio suggest 
1,the associ of abo blood group with indic of diseas sever and multiorgan dysfunct in covid 
1,hawk point in the cosmic microwav background  a challeng to the concept of inflat  mathemat institut 
1,oncotarget efavirenz induc dna damag respons pathway in lung cancer 
1,after the first peak us death rate from covid and from all caus remain higher than even countri with high covid mortal thi may have been a due to weak public health infrastructur and a decentr inconsist us respons to the pandem 
1, us presidenti elect associ with uptick in heart attack and stroke the hospit rate for acut cardiovascular diseas event in a larg southern california health system wa  time higher in the two day immedi after the  presidenti elect 
1,studi find no evid for coupl look more alik as time pass they did howev look more alik than random pair of peopl at the start of their relationship peopl may seek out similarlook partner just as they look for mate with match valu and person 
1,associ of violenc with urban point of interest 
1,greater male than femal variabl in region brain structur across the lifespan 
1,the rage lung inflamm that can contribut to death from the flu can be stop in it track by a drug deriv from mg a natur occur human protein a new studi in mice suggest the treatment protect lung without kill the flu viru 
1,relationship valu and econom valu are evalu by the same part of the brain accord to a new studi publish in the journal social neurosci 
1,uv light is most strongli associ with lower covid growth project suggest that without intervent covid will decreas temporarili dure summer rebound by autumn and peak next winter 
1,lower occup prestig increas probabl of face econom hardship dure covid lockdowns—loom job loss incom loss and workload decline—which exacerb socioeconom inequ and feel of depress and health anxieti 
1,children rais by samesex parent from birth perform better than children rais by differentsex parent in both primari and secondari educ data from the netherland which wa the first countri to legal samesex marriag in  
1,the thick skin bia in judgment about peopl in poverti 
1,annual resolv atlant sea surfac temperatur variabl over the past  year 
1,iit madra develop sustain antibacteri biodegrad food wrapper that can preserv food for  day and said to be biodegrad within  day 
1,effici cu remov from cuedta complexcontain wastewat use electrochem control sacrifici iron anod 
1,effect of school closur on mortal from coronaviru diseas  old and new predict 
1,confus  wa the most common neurolog manifest in patient with covid follow by impair conscious  agit  and headach  ischem stroke  were the most frequent neuroimag find 
1,an examin of racial differ in the disciplin of polic offic in three of the largest us citi consist found that black offic were more frequent disciplin for misconduct than white offic despit an essenti equal number of alleg be level 
1,the relationship between the level of copper lead mercuri and autism disord a metaanalysi 
1,genderrol ideolog and height prefer in mate select 
1,for everi two death attribut to covid in the us a third american die as a result of the pandem accord to new data publish in the journal of the american medic associ 
1,epidur analgesia dure labor and risk of autism spectrum disord in offspr 
1,enzym conform influenc the perform of lipase‐pow nanomotor 
1,microwav plastic wast can gener clean hydrogen 
1,high plain grain product drop as groundwat disappear 
1,rapid character and calibr of optic spectromet with excess nois in multiwavelength light instead of singlewavelength laser 
1,peopl who believ that the antimalari drug chloroquin is an effect remedi against covid are less like to say they will receiv a vaccin for the viru when one is avail accord to new research 
1,close examin of friction wear on an atom scale 
1,if countri want to lower emiss as substanti and costeffect as possibl they should priorit support for renew rather than nuclear power countri around the world with larger scale nation nuclear attach do not tend to show significantli lower carbon emiss 
1,dopamin and serotonin are at work at subsecond speed to shape how peopl perceiv the world and take action research can measur the activ of dopamin and serotonin — whose receptor and uptak site are therapeut target for disord from depress to parkinson’ diseas 
1,research combin heat and humid to disinfect n mask for reus  gentli heat n mask at a rel high humid wa found to inactiv ani sarscov viru trap within without degrad the masks’ perform 
1,low frequenc radio observ of the ‘quiet’ corona dure the descend phase of sunspot cycl  
1,chemist creat new crystal form of insecticid boost it abil to fight mosquito and malariaresearch use a simpl inexpens techniqu to develop a new fastact form of deltamethrin that may help with grow insecticid resist 
1,cambridg game ‘prebunks’ covid conspiraci as part of the uk government’ fight against fake news that is cost live  by give peopl a tast of the techniqu use to spread fake news on social media it increas their abil to identifi and disregard misinform in the futur 
1,the coronaviru that caus covid can live for up to  day on surfac such as mobil phone screen and atm — much longer than previous thought — new australian research ha found 
1,a studi examin the link between weight and happi found that one happi score reach it highest level when bmi is  the studi of  peopl in china found that be extrem thin is not better than be obes those with veri low and veri high bmi score lowest on happi 
1,covid in the unit state trajectori and second surg behavior 
1,pandemicrel stress lead to less employe engag but a support boss can make a differ studi in china and us find 
1,studi discov process that may have produc first organ molecul for life on earth the process which is similar to what might have occur in some ancient underwat hydrotherm vent may also have relev to the search for life elsewher in the univers 
1,the us had more covid death per capita than  of  comparison countri uk spain belgium the analysi is robust to countrylevel differ in covid death code and captur indirect pandem effect no causal claim 
1,anticip and identifi collater damag in genom edit 
1,emot abus  neglect of children is associ with more advers outcom in adult life than sexual or physic abus longterm cognit psycholog addict sexual health and physic health outcom were assess in  children over  decad 
1,estim temperatur of heat lower palaeolith flint artefact 
1, of peopl who test posit for covid dure lockdown did not have viru symptom cough andor fever andor loss of tastesmel the studi includ data from a repres popul sampl of  peopl live in england wale and northern ireland 
1,research have investig ancient leather ball discov in the grave of hors rider in northwest china they are  year old make them the oldest ball in eurasia the find suggest amongst other that the mount warrior of central asia play ball game to keep themselv fit 
1,local quantum energi condit in nonlorentzinvari quantum field theori 
1,for the first time ever scientist caught time crystal interact 
1, sverig riksbank prize in econom scienc in memori of alfr nobel discuss thread award jointli to paul r milgrom and robert b wilson for improv to auction theori and invent of new auction format 
1,a new speci of longirostrin plioplatecarpin mosasaur squamata mosasaurida from the late cretac of morocco with a reevalu of the problemat taxon ‘platecarpus’ ptychodon 
1,labmad ‘miniproteins’ could block the coronaviru from infect cell 
1,end hunger scienc must stop neglect smallhold farmer policymak urgent need idea on way to end hunger but a global review of the literatur find that most research have had the wrong prioriti 
1,pioneer analysi of  millionyearold teeth belong to the earliest mammal suggest they function like their coldblood counterpart  reptil lead less activ but much longer live 
1,new clue to chemic origin of metabol at dawn of life 
1,to protect nature’ benefit focu on peopl new paper call for the consider of people’ divers need in order to develop effect naturebas polici and invest in ecosystem 
1,hydroxychloroquin doe not counter sarscov in hamster but a high dose of favipiravir doe 
1,cerebrospin fluid leak after nasal swab test for coronaviru diseas   jama network 
1,the european media portray of climat chang implic for the social mobil toward climat action 
1,biochar as influenc by feedstock variabl implic and opportun for phosphoru manag 
1,new studi find that spous face do not becom ani more similar with the passag of time 
1,differ in carbon emiss reduct between countri pursu renew electr versu nuclear power 
1,anosmia loss of smell is associ with lower inhospit mortal in covid hospit covid patient with anosmia had a lower adjust mortal rate and less sever cours of the diseas thi could be relat to a distinct clinic present and a differ inflammatori respons 
1,studi bacteri biofilm epfl scientist have discov that mechan forc within them are suffici to deform the soft materi they grow on eg biolog tissu suggest a “mechanical” mode of bacteri infect 
1,the paper review devic architectur work mechan materi innov and recent progress for lead nmsm nonvolatil multist memori candid flash memori magnet randomaccess memori resist randomaccess memori ferroelectr randomaccess memori phasechang memori 
1,find suggest that continu trend in femal educ attain  access to contracept will hasten declin in fertil  slow popul growth polici option to adapt to continu low fertil while sustain  enhanc femal reproduct health will be crucial in year to come 
1,a circular economi could save the world’ economi postcovid 
1,bimod neuromodul combin sound and tongu stimul reduc tinnitu symptom in a larg random clinic studi 
1,for the first time a tightknit group of galaxi ha been caught in the act of feed a supermass black hole—which could help explain a puzzl astronom have long sought to put togeth 
1,lowcost measur of face mask efficaci for filter expel droplet dure speech 
1,trump support is less import than ethnic antagon in explain antidemocrat view among republican 
1,observ learn of fear in real time procedur 
1,the megaimport of de novo lipogenesi in platelet product 
1,discoveri of cortexwid variat of the intracellular concentr of atp in excitatori neuron across the sleepwak state in mice the neuron intracellular atp level greatli decreas wherea the cerebr hemodynam for energi suppli greatli increas dure rem sleep 
1,rat that use whisker to hunt underwat prey is realli four speci 
1,children – year of age might be effect sarscov spreader research report a cluster of surprisingli high spread of covid associ with a singl nurseri in poland the find contrast with the presum neglig role of children in drive the sarscov pandem 
1,young adult age – year demonstr the earliest increas in covid posit increas  day befor a us counti is identifi as a hotspot thi underscor the import of reduc transmiss from younger popul to those at highest risk for sever ill or death 
1,neandert babi had stocki chest like their parent 
1,clean d superconduct in a bulk van der waal superlattic 
1,diamond are a quantum scientist’ best friend the discoveri of triplet spin superconduct in diamond ha the potenti to revolutionis the hightech industri 
1,coronaviru can persist for four week on banknot studi find 
1,physicist have discov the ultim speed limit of sound 
1,waspb is a hot jupit that wa recent found to possess rich emissionday side and transmiss limb spectra suggest of the presenc of a multitud of chemic speci in the atmospher 
1,user whose selfassess person match up well with their behaviour on the site — those who in other word express themselv more authent on facebook — report more life satisfact than those whose selfdescript differ from their behaviour 
1,vitamin d defici predict latent tb reactiv independ of prevent therapi a longitudin studi 
1,exposur to static magnet and electr field treat type  diabet  static magnet and electr field rapidli amelior insulin resist and glucos intoler in as few as  day with no observ advers effect when appli to mous model of type  diabet 
1,contrari to popular belief let your mind wander on the job doe not necessarili hurt your work when peopl feel a strong person identif with their profess daydream can actual boost creativ problemsolv 
1,subacromi decompress shoulder surgeri no better than placebo surgeri at  year follow up 
1,immun cell activ in sever covid resembl lupu thi may explain whi some peopl infect with sarscov produc abund antibodi against the viru yet experi poor outcom 
1,massiv young star are factori for ingredi to life  nasa stratospher observatori for infrar astronomi found massiv quantiti of water and organ molecul in these swirl diskshap cloud offer insight into how some key ingredi of life get incorpor into planet 
1,dietari thiamin influenc lasparaginas sensit in a subset of leukemia cell 
1,human emiss of nitrou oxid no — a greenhous ga  time more potent than carbon dioxid co — increas by  per cent between  and  the studi involv  scientist from  institut in  countri 
1,phone call help creat closer bond than text social interact via voic creat stronger social bond and no increas in awkward compar to text interact but miscalibr expect about awkward or connect could lead to suboptim prefer for textbas media 
1,slow blink realli doe help convinc cat that you want to be friend 
1,peopl who are given clotbust drug after stroke may recov better if they also are given a therapi call remot ischem postcondit remot ischem condit is when blood flow and the oxygen it carri is stop and then restor repeatedli by blood pressur cuff worn on arm 
1,the fastest possibl speed of sound vᵤ in condens matter ha been deriv from fundament physic constant express in term of the fine structur constant α the protontoelectron mass ratio mₚmₑ and the speed of light c vᵤ  αcmₚmₑ½ ≈  km 
1,an invest of  billion usd would adequ protect healthcar worker in all low and middleincom countri dure the pandem thi intervent would save  live cost  usd per hcw case avert and  usd per hcw life save the societ roi would be  billion usd 
1,redesign ticket in nyc given for lowlevel offens like loiter reduc miss court date by  percent text messag help even more find suggest peopl are not intent skip their court date so much as forget or overlook the inform 
1,heavi metal hit the top  a new result by the cm collabor accept by the journal physic review letter demonstr for the first time that top quark are produc in nucleusnucleu collis 
1,human microevolut see more peopl born without wisdom teeth and an extra arteri 
1,a fossil of an ancient eleph age between  to  year old ha been discov in a limeston cave in gopeng perak 
1,remdesivir wa superior to placebo in shorten the time to recoveri in adult who were hospit with covid with lower respiratori tract infect n doubleblind random placebocontrol trial nejm  oct  
1,a studi of pregnant mice found that high amount of folic acid dure pregnanc harm the brain develop of embryo research say the find indic that more investig is need about the best recommend dosag for pregnant women 
1,studi demonstr that ant can not onli recogn the increas in forag risk but also make correspond adjust to their strategi by use a specif tool author suggest that social insect can be highli flexibl in their tool use in respons to ecolog challeng 
1,research find new rule for rememb and forget in our brain 
1,research have develop a highperform reusabl rutheniumbas catalyst for the product of primari amin they show that the catalyst work at low temperatur °c the readi avail of alcohol  low cost of ammonia make the system costeffect and environment friendli 
1,studi find that sarscov can spread among domest cat 
1,on averag the number of excess covid case per  resid in us state reopen without mask is  time the number in state reopen with mask after  week  excess death were prevent within  week in  state that implement mask mandat prior to reopen 
1,realtim audio and visual display of the coronaviru genom sound is use to display the function of the rna genom a synchronis anim display show translat and transcript the start and end of gene untransl region and metadata regard regulatori region can be distinguish 
1,antibodi in serum sampl from patient infect dure the  sarscov outbreak effect neutral sarscov infect in cultur cell accord to a new studi 
1,new psycholog studi suggest intellectu humil ha import sociopolit consequ 
1,exposur to static magnet and electr field treat type  diabet 
1,a thalam orphan receptor drive variabl in shortterm memori 
1,largescal chang in earth’ climat may origin in the pacif new find suggest that the melt of alaska’ remain glacier into the north pacif could have farrang effect on global ocean circul and the climat in come centuri 
1,compar peopl dream form befor covid to dure the pandem outbreak peopl now have heighten dream imageri involv anim chang in locat food and human head  theme that reflect peopl anxieti dure thi time 
1,preschool were better at calcul divis in share scenario than nonsoci scenario thi context effect wa not detect for addit or subtract n   
1,nitrogen fertilis use could ‘threaten global climat goals’ 
1,femal surgeon perform less complex case than their male peer even after account for subspecialti and senior these gender differ are not due to avail from compet profession or famili oblig 
1,effect of poverti on childhood develop seen in children as young as  how kindergarten teacher help ucla research highlight the impact of socioeconom barrier on children’ health and develop 
1,how do you predict unpreced event research combin avalanch physic with ecosystem data to creat a comput method for predict extrem ecolog event 
1,beaver castor spp provid human with essenti ecosystem servic estim at sever  million us dollar 
1,most covid coronaviru patient in southern california dure the earli month of the pandem appear to have been infect by a variant of the sarscov viru introduc to the region from new york state via europ not directli from china where the viru wa first detect 
1,three fossil found in a lignit mine in southeastern yunan provinc china are about  million year old indic monkey exist in asia at the same time as ape and are probabl the ancestor of some of the modern monkey in the area 
1,new studi find that rightw authoritarian aren’t veri funni peopl 
1,a new studi of just over  million marri coupl found that spous of icu patient may have an increas risk for cardiovascular event – similar to brokenheart syndrom 
1,peopl who surviv seriou covid have longlast immun respons against sarscov accord to a new studi led by harvard medic school research at massachusett gener hospit 
1,multidrugresist bacteria infect like mrsa and vre decreas by up to  in hospit dure the covid pandem due to increas awar of hand wash clean equip after use and appropri person protect equip ppe by healthcar worker 
1,in the netherland children of lesbian and gay parent do better at school 
1,foreign actor are again use twitter to interfer with the us elect network analysi combin with ml found polit commun target by troll  highli network account strateg boost hyper partisan messag and support trumpwork against biden 
1,well preserv yearold brain cell found in vesuviu victim the extrem heat of the erupt and the rapid cool that follow essenti turn the brain materi to a glassi materi freez the neuron structur and leav them intact 
1,gluten consumpt may contribut to worldwid obes preval studi 
1,plasma exchang encourag as novel alzheim treatment 
1,popul abund of varroa destructor and it effect on api mellifera scutellata coloni in kenya 
1,women’ dream have been more neg affect by the covid pandem than men’ dream accord to a new intern studi 
1,frontier  the import of cursiv handwrit over typewrit for learn in the classroom a highdens eeg studi of yearold children and young adult 
1,research have observ black import fire ant use sand to draw liquid food out of contain when face with the risk of drown thi is the first time thi sophist tool use ha been report in anim 
1,select and crossreact sarscov t cell epitop in unexpos human 
1,success cultur of permafrost bacteria alreadi show antibiot resist gene 
1,estim molecular preserv of the intestin microbiom via metagenom analys of latrin sediment from two mediev citi 
1,earli hydroxychloroquin use reduc icu admiss by  in covid patient 
1,loss of bclexpress t follicular helper cell and germin center in covid 
1,suffer from pain caus consum to spend more money than they otherwis would – perhap  more find suggest that peopl in physic pain may be more suscept to surg price and other market trick that get peopl to spend more money 
1,atmospher eros by giant impact onto terrestri planet a scale law for ani speed angl mass and densiti 
1,peopl with thi mutat can’t smell stinki fish   of iceland carri inabl to smell trimethylamin 
1,oxytocin is known for it prosoci effect but can also have neg effect promot social anxieti when produc in certain part of the brain 
1,research scour the dna of more than  peopl in iceland for genet variant that influenc odour percept they found that a mutat in a gene that encod a specif odour receptor in the nasal caviti affect a person’ percept of a compound in spoil and ferment fish 
1,emiss of nitrou oxid a climat superpollut are rise fast on a worstcas trajectori 
1,supercharg clone spark scarlet fever reemerg a virul varieti of streptococcu pyogen bacteria preval in modern ne asian scarlet fever outbreak ha been found to have acquir from a viru the abil to secret novel toxin thu allow it to better colonis it host 
1,a new speci of toothless dinosaur that had just two finger on each arm ha been discov in the gobi desert in mongolia 
1,autoimmunelik respons in sever covid 
1,in a mazelik experi n research confirm human have a spatial memori bia that appear to priorit caloriedens energyrich food over lowcalori altern 
1,as the osirisrex mission inch closer to it goal of collect a sampl from asteroid bennu it ha been feed scientist a wealth of data that ha help them retrac the origin of the build block of life in the univers 
1,dogs’ brain ‘not hardwired’ to respond to human face studi of brain activ show no differ when dog see back or front of a head 
1,aalto univers research have develop a black silicon photodetector that ha reach abov  effici in uv rang without extern amplif break the theoret onephoton–oneelectron barrier known as the shockleyqueiss limit 
1,zoologist have uncov a modernday exampl of rapid evolut in action they discov that male and femal sulawesi babbler pellorneum celebens a speci of bird have evolv to attain differ size on small island and in quickfir time 
1,psychopathi reduc social distanc behavior via moral disengag a cognit mechan that allow someon to ignor their own sens of moral account might help explain whi those with “dark” person trait are more like to ignor guidelin meant to slow the spread of covid 
1,osirisrex unlock more secret from asteroid bennu  carbonbear materi includ organ compound are widespread on bennu’ surfac and present at site nightingal thi organ matter may contain carbon in a form often found in biolog or in compound associ with biolog 
1,gender face mask percept and face mask wear men and women have similar selfreport frequenc of face mask wear but differ face mask percept dure the covid pandem 
1,studi confirm that serum and saliva igg antibodi to sarscov are maintain in the major of covid patient for at least  month postsymptom onset 
1,the number of covid case in arizona stabil and then decreas after statewid limit and closur of certain busi such as bar gym movi theater commun mitig measur includ mask wear can help prevent transmiss of sarscov and decreas covid case 
1,effect of school closur on mortal from coronaviru diseas  old and new predict 
1,inhibit ebola viru and sarscov entri 
1,‘aw walks’ boost emot wellb in a new studi publish sept  in the journal emot older adult who took weekli minut “aw walks” for eight week report increas posit emot and less distress in their daili live 
