subreddit,title
1,an analysi of data from sweden’ entir popul found that peopl with attent deficit hyperact disord adhd who also had the highest risk of credit default were three to four time more like to commit suicid than those with onli one of these two risk factor 
1,studi find yoga and medit reduc chronic pain particip in an eightweek mindfulnessbas stress reduct cours report signific improv in level of pain depress and disabl 
1,sleep disturb in bereav a systemat review 
1,research have shed new insight into recent debat regard the evolut of the band structur with temperatur in topolog insul which exhibit unusu quantum phenomena and are envis to be crucial in nextgener electron spintron and quantum comput 
1,novel nuclear reaction observ in bremsstrahlungirradi deuter metal 
1,decent live for all doe not have to cost the earth global energi consumpt in  could be reduc to the level of the s and still provid a decent standard of live for a popul three time larger accord to a new studi 
1,sarscov rapidplex a graphenebas multiplex telemedicin platform for rapid and lowcost covid diagnosi and monitor 
1,a short review of biolog research on the develop of sexual orient 
1,maresin and resolvin e promot regen properti of periodont ligament stem cell under inflammatori condit 
1,the secret network use to move money offshor research have uncov a highli unusu network pattern within the panama paper show how fortun can be easili hidden in secret offshor shell corpor and how these remain difficult to trace and take down 
1,chandra spot possibl extragalact planet in messier  
1,physicist build circuit that gener clean limitless lowpow voltag from graphen refut assert that brownian motion cannot do work 
1,a neighborhood’ overal socioeconom statu includ incom and educationlevel may influenc it residents’ risk of chronic kidney diseas an estim  million   — of us adult are estim to suffer from chronic kidney diseas and nine out of  of those case go undiagnos 
1,humans’ pupillari contagion extend to cat and dog a new studi find particip pupil size chang in respons to view photo of cat and dog with vari pupil size the respons wa similar regardless of whether the particip were cat peopl or dog peopl 
1,flower are chang color due to chang in climat 
1,hpv vaccin help prevent invas cervic cancer research is first to show vaccin help protect against more than just precancer chang 
1,research at epfl have success overcom a limit problem with stabil the bestperform formul of metalhalid perovskit film a key player in a rang of applic includ solar cell 
1,contrari to popular belief the psycholog impact of social distanc and lockdown measur are hit introvert individu harder than their extravert counterpart accord to new research publish in frontier in psycholog 
1,loss of smell a ‘highli specific’ indic of covid  of  peopl with smell andor tast loss had sarscov antibodi  had neither cough nor fever and particip with loss of smell were  time more to have sarscov antibodi compar with those with loss of tast 
1,daili alcohol intak trigger aberr synapt prune lead to synaps loss and anxietylik behavior a chronic bing drink protocol result in depress neurotransmiss and increas anxietylik behavior in mice by activ microglia that destroy neuron connect 
1,the preval of dementia in countri where more than one languag is spoken is  lower than in those region where the popul use onli one languag to commun activ bilingu is an import predictor of delay in the onset of symptom of mild cognit impair 
1,a new map show where asian giant hornet could thrive in the us 
1,research report a softwar platform that use natur languag process to translat the organ chemistri literatur directli into edit code which in turn can be compil to drive autom synthesi of the compound in the laboratori 
1,feed csection newborn their mother fece may help build healthi gut flora studi find 
1,melt antarct ice expos yearold penguin that still look fresh 
1,trappedion quantum comput set new mark for quantum volum 
1,for the first time ever scientist caught time crystal interact 
1,when paint reveal increas in social trust by appli faceprocess softwar to two group of portrait scientist reveal increas in facial display of trustworthi in european paint between the th and st centuri which close follow rise live standard over the period 
1,research in sweden show that it is possibl to stimul stem cell in the mous spinal cord to form larg amount of new oligodendrocyt cell that are essenti to the abil of neuron to transmit signal and thu to help repair the spinal cord after injuri 
1,the testimoni of tree how volcan erupt shape  year of world histori 
1,detect biomark of secondhand marijuana smoke in young children 
1,worldchang event such as climat chang the covid pandem and street protest in citi around the globe may be make mani entrepreneur avers to launch longterm enterpris the stronger the percept is that an lmc is close the more riskavers entrepreneur may becom 
1,ychromosom gene sri ha two part not one and lack the second part is what make mice male 
1,the allur of hyper masculin and cryptofasc for men who join the proud boy 
1,lesbian gay bisexu experi migrain at a rate  higher than heterosexu or mostli straight peopl  in  adult will have migrain headach in their lifetim but among lgb peopl that figur is  in  research specul that ad stress and discrimin may be respons 
1,there wa no clinic benefit of hydroxychloroquin administ daili for  week as preexposur prophylaxi in hospitalbas hcw expos to patient with covid 
1,use an fmri scientist scan peopl brain as they watch an episod of the tv show sherlock they found our brain can success predict other action up to about  second into the futur on averag 
1,the activ ingredi of the hallucinogen tea ayahuasca dmt posit regul adult neurogenesi both in vitro and in vivo also research observ that dmt increas perform on memori test in rodent 
1,research discov that thirst is dynam regul by bodytobrain signal that predict chang in hydrat befor they occur and in turn guid drink behavior 
1,someday even wet forest could burn due to climat chang  while today fire are exacerb by dri condit research found that forest fire dure ocean anox event  oae in the cretac period increas even in wet region due to chang in global climat 
1,gene drive technolog in which bioengin gene are forc to spread through a popul could one day be use to suppress infect with cytomegaloviru a type of herp viru 
1,stem cell can repair parkinson’sdamag circuit in mous brain 
1,stroke patient who get profession rehabilit train in their home through live video consult may recov their motor skill better than those who do their rehab in person with a therapist at an outpati rehabilit facil accord to a studi 
1,startup support by arpa us advanc research project agenc – energi were more innov than other file patent at twice the rate of similar cleantech firm but an invest gap may remain suggest that further intervent are need to help commerci new clean energi tech 
1,the largestev studi of tree ring from norilsk in the russian arctic ha shown that the direct and indirect effect of industri pollut in the region and beyond are far wors than previous thought 
1,epidemiolog and transmiss dynam of covid in two indian state 
1,covid contact trace show children and young adult are key to the spread evid of superspread 
1,melt ice reveal mummifi penguin in antarctica 
1,studi of safeti and immunogen of moderna sarscov mrna vaccin in older adult show that advers event associ with the mrna vaccin were mainli mild or moder the μg dose induc higher bind and neutralizingantibodi titer than the μg dose 
1,the social media account of the brand steakumm recent tweet to counter covid misinform thi move attract k new follow to their twitter in a week analysi of thi success show the valu of posit expect violat and activ corpor commit to the public good 
1,global heat warm up night faster than day  effect seen across much of world will have profound consequ warn scientist 
1,effect of freebas and proton nicotin on nicotin yield from electron cigarett with vari power and liquid vehicl 
1,greenland could lose more ice thi centuri than it ha in  year “the paper is also an answer to those who dismiss the ongo effect of climat chang with ‘the earth ha alway changed’—and the answer is ‘not at thi pace’” scambo say 
1,scientist have for the first time map tini filament in the inner ear they found that those filament oper like veri small handshak the find publish in pna could help research understand whi and how peopl lose their hear 
1,exerciseinduc immun system respons antiinflammatori statu on peripher and central organ 
1,from san diego to itali studi suggest wisdom can protect against loneli  crosscultur studi find a strong invers correl between loneli and wisdom 
1,crossreact sarscov peptid reveal preexist t cell respons in  of unexpos individu and valid similar with common cold coronavirus provid a function basi for heterolog immun in covid infect 
1,the number of alien nonn speci particularli insect arthropod and bird is expect to increas global by  by the middl of thi centuri compar to  the largest increas is expect in europ where the number of alien speci will increas by  
1,person interact are import driver of stem ident in girl 
1,earth lost  per cent of it atmospher dure asteroid impact thought to have creat the moon 
1,wasp use social eavesdrop to learn about individu rival 
1,cortison inject increas risk for knee replac in those with knee osteoarthr each inject increas the absolut risk of knee replac by  at nine year follow up 
1,primat brain size doe not predict their intellig systemat investig of the cognit abil of lemur which have rel small brain compar to other primat reveal that cognit abil of lemur hardli differ from those of monkey and great ape 
1,analysi of trump tweet show he sleep less and get angrier 
1,provid decent live with minimum energi a global scenario 
1,frame covid how we conceptu and discuss the pandem on twitter is shape by warrel terminolog more than other figur frame via topic model and linguist corpu analysi 
1,canadian studi suggest that reduct in prescrib opioid lead nonmed opioid user to riskier suppli 
1,amazon rainforest studi quantifi how clearcut dramat reduc carbon storag at the edg of the forest between  edg effect account for  million ton of carbon storag lost dure the timefram persist even as deforest outlook ha improv 
1,a new studi argu that children reason if an anim is own or not base on how much control the owner ha on the animal’ movement and how much freedom an anim ha to escap children use principl of control and autonomi to assess if a live be is own or not 
1,ventil system in mani modern offic build which are design to keep temperatur comfort and increas energi effici may increas the risk of exposur to the coronaviru particularli dure the come winter accord to research publish in the journal of fluid mechan 
1,first fossil feather ever found belong to archaeopteryx 
1,new speci of truffl found in congo thank to mushroommunch bonobo 
1,chromium steel wa first made in ancient persia accord to a new studi the find are signific given that materi scientist historian and archaeologist have long consid that chromium steel wa a th centuri innov 
1,adhd link to more financi distress and a fourfold higher risk of suicid for those with the most debt a new popul studi in sweden find 
1,a “global safeti net” to revers biodivers loss and stabil earth’ climat 
1,pregnanc loss a possibl link between olfact and miscarriag 
1,the origin and diversif of pteropod preced past perturb in the earth’ carbon cycl 
1,“liking” an articl onlin may mean less time spent read it peopl choos selfexpress over engag studi find 
1,belief about sexual orient link to vote behavior in the  presidenti elect 
1,tick toward a nuclear clock  the highprecis measur of a nuclear transit of a thorium isotop is a key step toward the develop of a nuclear optic clock 
1,scientist explor a novel approach that can be use to earli detect the onset of flutter solv one of the main problem that ha been hold back the design of turbin new method for earli flutter detect will help in the develop of safer and more ecofriendli turbin in aircraft 
1,a studi conduct by scientist at the univers of haifa find that wholepl medic cannabi doe not have a widespread impact on cognit in older chronic pain patient 
1,sarscov use cd to infect t helper lymphocyt 
1,angiogen potenti is reduc in skelet muscl of age women 
1,in a random clinic trial includ  peopl classifi as overweight or obes timerestrict eat a form of intermitt fast did not help peopl lose weight more than eat three meal per day intermitt fast did caus peopl to lose lean mass includ muscl 
1,onethird of peopl in monogam relationship fantas about be in some type of open relationship studi suggest 
1,psychotherapi is move onlin dure covid the number of patient treat on averag per week in person contact decreas and remot psychotherapi increas with more patient be treat via the internet than via telephon dure the covid situat 
1,“liking” an articl onlin may mean less time spent read it accord to a studi of  us colleg student view on controversi topic becam stronger after vote on articl that agre with their view even when studi particip spent less time read them 
1,passeng from the rubi princess cruis ship may have infect up to  peopl with covid on a singl domest flight between sydney and perth in march the find base on genom sequenc ha prompt qanta to step up demand for a nation protocol for share of passeng manifest 
1,research use  famili tree to map migrat pattern across the us identifi a  million individu longitudin geosoci network 
1,the major genet risk factor for sever covid is inherit from neanderth and is carri by  of peopl in south asia and  of peopl in europ today 
1,ai learn to trace neuron pathway  cold spring harbor laboratori cshl scientist have taught comput to recogn a neuron in microscop imag of the brain more effici than ani previou approach 
1,longterm exposur to “lowdose” bisphenol a decreas mitochondri dna copi number and acceler telomer shorten in human cd  t cell 
1,mice are not human the case of p 
1,studi show keep gratitud journal reduc gossip incivil in workplac 
1,gut microbiom may promot fetal brain develop 
1,understand the effect of age on the genom epfl scientist have measur the molecular footprint that age leav on variou mous and human tissu use the data they have identifi like regul of thi central process 
1,mycobacterium tuberculosi progress through two phase of latent infect in human 
1,speech can produc jetlik transport relev to asymptomat spread of viru 
1,maxim the valu of forest restor for tropic mammal by detect threedimension habitat associ 
1,impact of genet mutat on cocain addict elucid scientist recent demonstr that two gene mutat involv in the conform of nicotin receptor in the brain appear to play a role in variou aspect of cocain addict 
1,crimin of sex work increas std among femal sex worker by  and decreas the earn of the women who left sex work due to crimin the studi use a quasinatur experi where one district of indonesia unexpectedli crimin sex work 
1,global wildfir at the kpg extinct event have now been cast into doubt as new evid indic previous thought burn materi is in fact organ matter eject into the atmospher where it circul the globe within a few hour 
1,the rise of covid case is associ with support for world leader 
1,low risk of covid transmiss by fomit surfac contact in reallif condit environment contamin lead to sarscov transmiss is unlik to occur in reallif condit provid that standard clean procedur and precaut are enforc 
1,excess use of social media for covid health inform is relat to both depress and secondari trauma 
1,new scientif paper predict histor result for commonwealth fusion systems’ approach to commerci fusion energi 
1,a gene that help to control inflamm increas the risk of obes and wa turn off in an anim model to stop weight gain 
1,some physicist see tent evid of cosmic string from the big bang 
1,chronic exposur to hazard air pollut is associ with increas covid mortal 
1,scientist discov hidden draw beneath the ‘mona lisa’  the underdraw detect by multispectr analysi wa like creat use the spolvero techniqu a method for transfer a sketch to canva in which hole are prick along the outlin of an imag and dust with charcoal 
1,the stratif of the ocean – less dens water sit abov more dens water – is increas in other word the ocean are becom more stabl with less “upanddown” motion a more stabl ocean sound idyl but it creat a danger feedback loop for our warm planet 
1,studi on covid infect fatal ratio find that the infect fatal ratio of person between the age of  and  is  
1,transgend children who receiv genderaffirm medic care earlier in their live are less like to experi mental health issu like depress and anxieti 
1,comput scientist use manifold learn method to predict ecolog nich of microb base onli on genom sequenc 
1,flower are chang their color to adapt to climat chang research measur pigment in petal of  flower speci over time use museum specimen and uv camera they found that pigment increas an averag of yr from  with chang vari depend on flower structur 
1,a field experi reveal that peopl are more like to demand that rich member of societi should pay more tax when remind about ongo inequ through exposur to a symbol of wealth 
1,a studi of comet motion indic that the solar system ha a second align plane thi ha import implic for model of how comet origin form in the solar system 
1,the subtl effect of blood circul can be use to detect deep fake research show how a person’ heartbeat can reveal whether a video is real 
1,perceiv someon or someth as ugli is an aesthet heurist judgment that human evolv to alert us to the potenti threat of diseas ugli elicit disgust and prompt an avoid respons 
1,studi suggest link between unexplain miscarriag and how women perceiv men’ bodi odour 
1,studi find peopl have shortliv immun to season coronavirus 
1,converg evid of a causeandeffect relationship between exposur to natur and human psycholog and physic health 
1,mother are more like to suffer health limit after a son is incarcer a timedistribut fix effect analysi indic that the effect on matern health may persist or even grow over time 
1,compact nuclear fusion reactor is ‘veri like to work’ studi suggest 
1,the ocean appear to be stabil here whi it veri bad news  a more stabli stratifi ocean potenti favor more intens destruct hurrican 
1,research have found a snake use it enlarg posterior maxillari teeth to cut open the abdomen of a larg poison toad then insert it entir head and pull out the organ one by one while the prey is still aliv 
1,the hysteresi of the antarct ice sheet 
1,a psycholog trick chang diabet blood sugar level research at harvard univers discov that perceiv sugar intak affect blood sugar level in peopl with type  diabet more than actual sugar intak 
1,a new digit patholog tool “marrowquant” can quantifi bone marrow compart in standard histolog section and make it possibl to examin bone marrow biopsi as well as to revisit histor collect of bonemarrow sampl and even old clinic trial 
1,influenza vaccin coverag rate correl neg to all covid outcom less hospit less admiss to intens care less death 
1,older adult are like to be exclud from more than  of covid clinic trial and  of vaccin trial such exclus will limit the abil to evalu the efficaci dosag and advers effect of the intend treatment 
1,coin are wide use as measur of size in scientif public i have collect and analyz over hundr exampl 
1,air pollut particl and metal found in the placenta pollut particl includ metal have been found in the placenta of fifteen women in london accord to research 
1,strong activ of antibacteri t cell link to sever covid a type of antibacteri t cell socal mait cell are strongli activ in peopl with moder to sever covid diseas accord to a studi 
1,new superenzym eat plastic bottl six time faster breakthrough that build on plastic bug first discov by japan in  promis to enabl full recycl 
1,quantum entangl realiz between distant macroscop system 
1,studi into lefthanded find  genet variant that influenc it 
1,use openstreetmap googl map research find that just  of the global popul cannot reach healthcar within one hour if they have access to motor transport and that  cannot reach a healthcar facil by foot within one hour 
1,a new studi suggest there are neurobiolog constraint on women sexual fluiditi the find indic that differ in visual and attent process which cannot be voluntarili alter guid how women sexual respond to erot content 
1,human occupi the iberian peninsula  year earlier than previous believ research unearth stone tool in a cave in central portug chang the timelin for human absorb and replac neanderth popul 
1,research suggest impolit email can have a neg effect on work respons product and can even be link to insomnia at night which further relat to neg emot next morn deal with rude email at work can creat linger stress and take a toll on your wellb 
1,research have long sought materi in which light behav the way electron do in semiconductor a natur paper report that a workabl approach for grow such materi in bulk is at hand and could lead to advanc in comput 
1,metformin use is associ with slow cognit declin and reduc incid dementia in older adult with type  diabet the sydney memori and age studi 
1,effect of timerestrict eat on weight loss and other metabol paramet in women and men with overweight and obes  did not confer weight loss or cardiometabol benefit 
1,salti water lake found more than half a mile beneath mar surfac 
1,the vast major of young marri men in saudi arabia privat support women work outsid the home but they substanti underestim support by other similar men when they are inform about other men view they becom will to help their wive search for job 
1,an ultracompact xray freeelectron laser 
1,dure the  elect cycl polit polar tweet by russian troll about vaccin includ pro and antivaccin messag target at peopl with specif polit inclin by troll use an assort of fake persona type 
1,astrophysicist detect differ between how dark matter behav in theori and how it appear to act in realiti observ cluster substructur are more effici lens than predict by cold dark matter simul by more than an order of magnitud 
1,matern prenat mood and pregnancyspecif worri are associ with offspr psychiatr symptom in childhood 
1,new research find that the subject experi of time is link to learn thwart expect and neural fatigu 
1,research at uc san diego show that by control the print temperatur of liquid crystal elastom they can control the material’ degre of stiff and abil to contract what more they are abl to chang the stiff of differ area in the same materi by expos it to heat 
1,the firstev imag of a black hole is now a movi the short sequenc of frame show how the appear of the black hole’ surround chang over year as it graviti stir the materi around it 
1,scientist ice age hindcast shed light on futur climat combin new estim with ice core co valu research calcul climat sensit to have a median valu of c with veri littl chanc it is below c 
1,teacher stress link with higher risk of student suspens research find studi examin impact of teacher burnout on student behavior disciplin issu 
1,martian biolith a bioinspir regolith composit for closedloop extraterrestri manufactur 
1,the immunolog of multisystem inflammatori syndrom in children with covid 
1,the protein mr play an import role in control the threat of bacteria but where and how it recognis the threat could contribut to new immuneboost treatment 
1,individu with a greater sensit to tast and disgust are more like to hold cultur and social conserv valu relat to outgroup dynam thi work suggest that lowlevel physiolog differ in sensori process may shape an individual’ polit attitud and belief 
1,new yorker with ‘longhaul’ symptom are upend the narr about covid 
1,prelabour caesarean section and neurodevelopment outcom at  and  month of age an observ studi  bmc pregnanc and childbirth 
1,research have sequenc the genom of alexand fleming’ penicillin mould for the first time and compar it to later version the result reveal that the uk and us strain use slightli differ method to produc penicillin potenti suggest new rout for industri product 
1,coconut rhinocero beetl make unexpect ‘host shift’ to guam’ threaten cycad tree 
1,marin spong inspir the next gener of skyscrap and bridg 
1,a man die after eat a bag of black licoric everi day  natur compound caus cardiac arrest 
1,anim pet ownership seem to mitig some of the detriment psycholog effect of covid lockdown strength of the humananim bond in term of emot close or intimaci dimens appear to be independ of anim speci plo one  sep  
1,reopen k school dure the covid pandem priorit health equiti and commun consensu studi report from the nation academi of scienc engin and medicin 
1,a new proof of concept studi ha demonstr how speechanalyz ai tool can effect predict the level of loneli in older adult the ai system reportedli could qualit predict a subject’ loneli with  percent accuraci 
1,sarscov hamster model 
1,autoantibodi against type i ifn in patient with lifethreaten covid 
1,newfound brain structur explain whi some bird are so smart—and mayb even selfawar 
1,moon safe for longterm human explor first surfac radiat measur show 
1,research find that gene coexpress network in peripher blood n can be use as biomark for emot and behavior profil like attent problem rulebreak behavior or anxieti with depress 
1,futur attractor in  dimension graviti 
1,lochaid an ultralowcost hear aid for agerel hear loss 
