subreddit,title
0,presid remov pollut control on stream and wetland that would for the first time in decad allow landown and properti develop to dump pollut such as pesticid and fertil directli into mani of those waterway 
0,amanda feild ‘lsd can get deep down and reset the brain – like shake up a snow globe’ the campaign to legalis lsd in britain is gather pace psychedel may have a role to play in treat everyth from alcohol addict to alzheimer’ diseas to posttraumat stress disord 
0,scientist discov two new cannabinoid tetrahydrocannabiphorol thcp is allegedli  time more potent than thc cannabidiphorol cbdp is a cousin to cbd both demonstr how much more we can learn from studi marijuana into the futur 
0,we should be retreat alreadi from the coastlin scientist suggest after find warm water below greenland  andrew yang assert that peopl move away from the coast at the last democrat debat is the complet ration and correct choic for nasa scientist in greenland 
0,a yearold student ha just come up with a way to fight drugresist superbug without antibiot 
0,brooklyn’ latest craze make your own electr grid  use the same technolog that make bitcoin possibl neighbor are buy and sell renew energi to each other 
0,what if cocain could be made less euphor so that a singleus by a recov addict doesn’t result in a fullblown relaps scientist recent publish progress toward make thi idea a realiti – a gene therapi that would treat cocain addict by make cocain less reward 
0,futurist see ‘the end of the world as we know it for averag person’ roey tzezana say middleclass job will vanish polar between rich and poor will grow – and it will happen faster than you think 
0,at ce imposs burger  tast too real for vegetarian review 
0,amazon’ facial recognit match  member of congress to crimin mugshot 
0,high tech indoor farm use a hydropon system requir  less water than tradit agricultur to grow produc addit vertic farm requir less space so it is  time more product than a tradit farm on the same amount of land there is also no need for pesticid 
0,elon musk call on the public to preserv human conscious with starship i think we should becom a multiplanet civil while that window is open 
0,for the first time human stem cell are transform into matur insulinproduc cell as a potenti new treatment for type  diabet where patient can not produc enough insulin 
0,china and europ to build a base on the moon and launch other project into space  if space is to be explor peac it will requir intern collabor a spokesperson for the european space agenc said 
0,kid are take the fed  and possibl trump  to court over climat chang hi action will place the youth of america as well as futur gener at irrevers sever risk to the most devast consequ of global warm 
0,nz green are call for  billion to be pour into a conserv packag to creat naturebas job to reviv the covidriddl economi the packag is design to quickli gener up to  job 
0,will we look back at  as the year that open up remot work and onlin learn 
0,we’r fight the wrong trade battl with china the futur is clean energi  global invest in renew pass  trillion sinc  with china in the lead by far 
0,the death of the citi telework not the coronaviru is make urban live obsolet 
0,china’ crispr twin might have had their brain inadvert enhanc 
0,andrew yang launch univers basic incom trial run in south carolina 
0,shell plan to spend  billion a year on clean energi by   ceo say shift to renew electr car is acceler 
0,more than  african countri have join togeth in an intern mission to plant a massiv wall of tree run across the contin the treeplant project dub the great green wall of africa stretch across roughli  mile  kilomet 
0,elon musk’ bore co win chicago airport highspe train bid 
0,human may be accident geoengin the ocean  iron particl releas by industri activ are fall into the sea in greater quantiti than previous thought known as “iron fertilization” it could promot the growth of phytoplankton which natur suck up carbon dioxid 
0,a s vision of the futur 
0,all new home in wale will onli be heat and power by clean energi under new welsh govern plan hous account for  of all greenhous ga emiss in wale 
0,mcdonald’ respons to  minimum wage autom in everi store 
0,israel aim to elimin use of coal gasolin and diesel by  
0,farmer are increasingli leas their land for commun solar project as well as instal solar panel to cut their electr bill both method can gener more than  a month and help farmer diversifi their incom 
0,the eu is ban almost all coal mine on jan   everi unprofit coal mine in the european union must ceas product by the first day of  the date on which all public fund for the mine will come to an end 
0,new york health offici see marijuana as an altern to opioid  new york should legal recreat marijuana to temper the harm of opioid addict end racial dispar in enforc and boost tax revenu state health offici said 
0,these smart glass adjust to your vision automat  the glass liquid lens chang shape accord to the distanc of object make read glass and bifoc unnecessari 
0,these voter could approv the first us carbon fee big oil is spend million to defeat it if the washington state measur win it could begin a us movement to make the price of fossil fuel reflect their cost to the planet 
0,studi inequ rob  trillion from us worker each year 
0,nasa is plan to visit an asteroid made of gold and other preciou metal worth  quintillion  enough to give everyon on the planet  billion 
0,nerv transfer surgeri enabl tetrapleg patient to regain movement and function in hi elbow and hand 
0,bill gate and big oil back thi compani that’ tri to solv climat chang by suck co out of the air 
0,scientist discov way to make quantum state last  time longer 
0,electr car exceed m in europ as sale soar by more than  
0,research say theyv develop a super hous plant that can remov air pollut from your home includ carcinogen like chloroform and benzen 
0,china is expect to overfulfil it goal of cut greenhous ga emiss by  which will lay a foundat for achiev it  goal 
0,pari is get a white forest wooden tower that will featur  plant  it will featur residenti unit offic and retail 
0,wrong accus by an algorithm in what may be the first known case of it kind a faulti facial recognit match led to a michigan man arrest for a crime he did not commit unit state of america 
0,jacinda ardern flag fourday work week as way to rebuild new zealand after covid “we need to retain all the product benefit work from home ha brought includ cleaner air and a lack of gridlock lost product from commut while help busi stay afloat 
0,amazon could disrupt us healthcar by convert a standard healthcar interfac for it employe into a marketplac for individu and other employ 
0,rat with spinal cord injuri have regain the use of their paw after be given a groundbreak gene therapi that help to mend damag nerv in the spine by produc an enzym call chondroitinas which break down scar tissu as report in a new studi in the journal brain 
0,bill gate “consid a world where the ageold scourg of malaria is final erad    where hundr of million of peopl no longer suffer from tuberculosi    and where we have a cure for hiv” 
0,thi fli robot vacuum overcom the roomba’ biggest weak stair 
0,new york citi mayor bill de blasio announc on monday that public school would be particip in “meatless mondays” in an attempt to combat climat chang 
0,in a new world record scientist at ibm have captur  terabyt of uncompress data — or the equival of  million book — into a cartridg that can fit into the palm of your hand 
0,drone keep drop drug and porn into prison 
0,nation longest bike path will connect main to florida the east coast greenway will stretch from calai main to key west florida a mile distanc the project will provid nonmotor user a uniqu way to travel up and down the east coast through  citi and  state 
0,cocacola kellogg’ and nestl vow to cut all plastic wast in bid to tackl ocean pollut  hm mar and unilev also promis to elimin singleus plastic 
0,taiwan to ban dispos plastic item by  
0,china say the guid missil on it newest ship can destroy satellit in low earth orbit 
0,elon musk show test run of the bore compani electr slide 
0,russian scientist discov bacteria that neutral nuclear wast 
0,aidriven unemploy in hong kong can be offset by a tax on profit gener by robot  taken to anoth level tax on busi can also be use to fund a univers basic incom 
0,whi the widen wealth gap is bad news for everyon 
0,tesla batteri research say they doubl lifetim of batteri in tesla’ product  year ahead of time 
0,​south korea internet provid sk broadband roll out gbp internet use use gigabitpass optic network gpon technolog will roll out gbp and gbp internet servic in the second half of the year current coverag is  but it aim to expand thi to  by  
0,plan for coalfir power plant drop by almost half in   the shift from fossil fuel to clean sourc in the power sector is a posit one for health climat secur and job and by all indic the shift is unstopp 
0,an amazon engin made an aipow cat flap to stop hi cat from bring home dead anim 
0,germany’ solar panel produc record amount of electr exacerb market forc that were alreadi hammer profit of country’ remain coal plant ginclear sky help photovolta plant produc  megawatt on monday beat previou record 
0,the startup behind silicon valley’ favorit ‘bleeding’ veggi burger ha score a major victori in it battl for legitimaci  on monday the fda gave imposs food the offici green light that heme is safe to eat 
0,a newli discoverd miner can convert movement sunlight and heat into electr at the same time 
0,selfrepair organ could save your life in a heartbeat rather than grow cell in a dish and transplant them research want to switch labgrown stem cell insid the bodi so that we can heal ourselv from within 
0,will elon musk’ solar panel blanket america they probabl should a singl solar farm larg but contain to a singl us state could produc enough energi to power the nation’ entir grid 
0,european electr car sale surg by  in januari 
0,new bill promis an end to our privaci nightmar jail time to ceo who lie giant like facebook would also be requir to analyz ani algorithm that process consum data—to more close examin their impact on accuraci fair bia discrimin privaci and secur 
0,alien will like be discov within  year nobel prizewin astronom say  he wa award  nobel prize in physic on tuesday for groundbreak discoveri 
0,spacex success land it rocket on a float drone ship for the first time 
0,russia will beat nasa to mar and find water in the moon say putin we are plan unman and later man launch into deep space as part of a lunar program and for mar explor the closest mission is veri soon we are plan to launch a mission to mar in  
0,beef compani file petit against labgrown meat startup  the us cattlemen associ usca ha file a petit to the usda argu that labgrown meat startup should not be abl to call their product meat sinc they do not come from slaughter anim 
0,franki zapata flyboard frenchman cross english channel  french inventor franki zapata ha made the firstev success channel cross on a jetpow flyboard make the mile km journey in  minut 
0,the hyperloop industri could make bore old train and plane faster and comfier  “the good news is that even if hyperloop never take over the engin work go on now could produc tool and techniqu to improv exist industries” 
0,american realli want the us to adopt renew energi like wind and solar power while reject fossil fuel like coal 
0,graphenef silkworm produc a superstrong silk that conduct electr 
1,physicist stephen hawk die age  
1,the first pictur of a black hole open a new era of astrophys the supermass beast lie in a galaxi call m more than  million lightyear away 
1,sinc legal cannabi in  crime clearanc rate are increas faster in washington and colorado than the rest of countri suggest that legal may free polic to focu on more seriou crime 
1,rais the tax of graduat student by as much as  will be a disast for the usa 
1,no evid to support link between violent video game and behaviour  research at the univers of york have found no evid to support the theori that video game make player more violent 
1,new studi find that most redditor don’t actual read the articl they vote on 
1,scientist believ that the function of zebra stripe are to deter insect so a team of research paint black and white stripe on cow they found that it reduc the number of bite fli land on the cow by more than  
1,have kid make you happier but onli when they move out accord to a new studi which suggest that parent are happier than nonpar later in life when their children move out and becom sourc of social enjoy rather than stress n 
1,woman with ‘mutant’ gene who feel no pain and heal without scar discov by scientist she report numer burn and cut without pain often smell her burn flesh befor notic ani injuri as publish in the british journal of anaesthesia and could open door to new treatment 
1,the first human trial of a covid vaccin find that it is safe welltoler and induc a rapid immun respons “these result repres an import milestone” 
1,scientist replac  percent of cement with rice husk cinder limeston crush wast and silica sand give concret a rubberlik qualiti six to nine time more crackresist than regular concret it selfseal replac cement with plenti wast product and should be cheaper to use 
1,a new studi in the lancet by a team of yale epidemiologist find that medicar for all would save more than  live annual as well as  billion in cost 
1,mmr vaccin doe not caus autism anoth studi confirm 
1,tree stump that should be dead can be kept aliv by nearbi tree discov new studi which found a tree stump that should have die is be kept aliv by neighbour tree through an interconnect root system which may chang our view from tree as individu to forest as ‘superorganisms’ 
1,healthi obes doesn’t exist obes is not a benign condit  new studi publish in the journal of the american colleg of cardiolog show 
1,research find that crow know what they know and can ponder the content of their own mind a manifest of higher intellig and analyt thought long believ the sole provinc of human and a few other higher mammal 
1,venom from honeybe ha been found to rapidli kill aggress and hardtotreat breast cancer cell find new australian research the studi also found when the venom main compon wa combin with exist chemotherapi drug it wa extrem effici at reduc tumour growth in mice 
1,marijuana use among colleg student ha been trend upward for year but in state that have legal recreat marijuana use ha jump even higher after legal howev student show a greater drop in bing drink than their peer in state where marijuana is not legal 
1,bird death down  percent after paint wind turbin blade 
1,in seattl washington delay the start time of two high school by nearli an hour lengthen student daili sleep by more than half an hour and wa associ with reduc sleepi and increas academ perform 
1,selfdriv car will cruis to avoid pay to park suggest a new studi base on game theori which found that even when you factor in electr depreci wear and tear and mainten cruis cost about  cent an hour which is still cheaper than park even in a small town 
1,the unit state on a per capita basi spend much more on health care than other develop countri the chief reason is not greater health care util but higher price accord to a new studi from john hopkin 
1,us adult look to scientif organ like the center for diseas control and prevent rather than their presid to lead the country’ respons to the coronaviru pandem 
1,paleontologist have dug up a yearold mastodon skeleton that look like it wa butcher by human but they found it in america where peopl were not suppos to have arriv for anoth  year find could upend our understand of human histori 
1,industri methan emiss are  time higher than report and have been vastli underestim find a new studi use a googl street view car equip with a highprecis methan sensor they also were substanti higher than the epa estim for all industri process in the us 
1,babi even when hungri are will to give a tasti snack to a stranger in need new studi show the find demonstr that altruism the act of give away someth desir even at a cost to oneself begin in infanc and suggest that earli social experi can shape altruism 
1,human microevolut see more peopl born without wisdom teeth and an extra arteri 
1,children as young as age  express dislik of and are will to punish those who freeload off the work of other group member a new studi ha found but kid also make a clear distinct between those who freeload intent and those who have good reason whi they can’t contribut 
1,seven earthsiz planet found orbit an ultracool dwarf star are strong candid in the search for life outsid our solar system 
1,the netflix show  reason whi wa associ with a  increas in suicid rate among us youth age  in the month april  follow the show releas after account for ongo trend in suicid rate accord to a studi 
1,everi dollar spent on highqual earlychildhood program for disadvantag children return  over the longterm the program lead to reduct in taxpay cost associ with crime unemploy and healthcar as well as contribut to a betterprepar workforc 
1,cigarett butt are the most common form of litter on the planet  trillion are litter each year new research show that they sever impact plant growth the presenc of cigarett butt reduc root biomass by  germin success by  and shoot length by  
1,student whose sex ed program teach abstin as the onli way to protect sexual health have less favor attitud toward condom and are more like to have unprotect sex than student who learn safe sexual practic abstinenceonli sex educ program do not stop minor from have sex 
1,storebought tomato tast bland and scientist have discov a gene that give tomato their flavor is actual miss in about  percent of modern domest varieti the discoveri may help bring flavor back to tomato you can pick up in the produc section 
1,larg us studi find that marijuana law both recreat  medic appear to significantli reduc prescript opioid use 
1,in state where recreat marijuana ha been legal marijuana use among youth may actual be fall suggest a new studi of  million high school student thi may be becaus drug dealer are replac by licens dispensari that requir proof of age 
1,megathread world most prestigi scientif public issu unpreced critiqu of the trump administr 
1,scienc ama seri i am stephen hawk theoret physicist join me to talk about make the futur of technolog more human reddit ama 
1,supervisor with ‘bottomlin mentality’ driven by profit to the exclus of care about other outcom like employe wellb environ or ethic could be hurt their bottom line by lose the respect of their employe who counter by withhold perform accord to a new studi 
1,sleep less than the recommend eight hour a night is associ with intrus repetit thought like those seen in anxieti or depress accord to new research from binghamton univers state univers of new york 
1,cannabi use in pregnanc research discov that continu use of cannabi at  week of pregnanc wa associ with significantli lower birthweight head circumfer birth length and gestat age at birth as well as with more frequent sever neonat morbid or death 
1,from  to  the number of suicid among peopl age  to  increas  percent 
1,pablo escobar hippo have becom an invas speci in colombia 
1,breast cancer link to perman hair dye and chemic hair straighten in studi of almost  women 
1,in  the obama administr began issu press releas name facil that violat osha safeti and health regul thi name and shame led other facil to substanti improv their complianc and experi fewer work injuri the trump administr end the practic 
1,scientist have found supercor in hawaii’ kāne’oh bay where a reef is thrive despit develop dredg sewag and high temperatur in the lab the coral also withstood simul climat chang includ rise acid and temp the find could offer hope for the futur of coral 
1,about  of us adult are obes govern survey find 
1,research first to uncov how the cannabi plant creat import painreliev molecul that are  time more power at reduc inflamm than aspirin the discoveri unlock the potenti to creat a natur deriv pain treatment for relief of acut and chronic pain beyond opioid 
1,peopl who are night owl and those who are morn lark have a fundament differ in brain function thi differ is whi we should rethink the to workday say research 
1,instead of ‘find your passion’ tri develop it stanford scholar say the belief that interest arriv fulli form and must simpli be “found” can lead peopl to limit their pursuit of new field and give up when they encount challeng accord to a new stanford studi 
1,men initi sex more than three time as often as women do in a longterm heterosexu relationship howev sex happen far more often when the woman take the initi suggest it is the woman who set limit and passion play a signific role in sex frequenc suggest a new studi 
1,a team of chemic engin from australia and china ha develop a sustain solarpow way to desalin water in just  minut thi process can creat close to  gallon of clean drink water per kilogram of filtrat materi and can be use for multipl cycl 
1,binghamton univers research have been work on a selfheal concret that use a specif type of fungi as a heal agent when the fungu is mix with concret it lie dormant until crack appear when spore germin grow and precipit calcium carbon to heal the crack 
1,teen birth rate spike in texa after fund for famili plan servic wa reduc by  in  
1,new studi find simpl way to inocul teen against junk food market when tap into teens’ desir to rebel by frame corpor as manipul market tri to hook consum on addict junk food for financi gain teenag boy cut back junk food purchas by  
1,after take lsd or psilocybin  percent of alcohol no longer met the criteria for the disord and  percent credit their psychedel experi for their lifestyl chang 
1,in a new studi american disproportion chose the year of their own youth as the country’ greatest year – no matter how old they were now thi find is the latest involv a phenomenon known as the reminisc bump 
1,scientist discov clean water ice just below mar surfac 
1,young children would rather explor than get reward a studi of american  and  yearold find and their explor is not random the studi show children approach explor systemat to make sure they didn’t miss anyth 
1,research say if parent want to success cut back on their child’ screentim they must first cut back on screentim themselv 
1,a new studi make it clear after univers mask wa implement at mass gener brigham the rate of covid infect among health care worker drop significantli for those who have been wait for data befor adopt the practic thi paper make it clear mask work 
1,colleg student with access to recreat cannabi on averag earn wors grade and fail class at a higher rate in a control studi 
1,rich student who have poor classmat becom i more prosoci gener and egalitarian and ii less like to discrimin against poor student and more will to social with them these effect are driven by person interact between rich and poor student 
1,climat chang contrarian are get  per cent more media coverag than scientist who support the consensu view that climat chang is manmad a new studi ha found 
1,adolesc who smoke marijuana as earli as  do wors by  on some cognit test and drop out of school at a higher rate than nonsmok but if they hold off until age  theyr less at risk and perform equal well as adolesc who did not use cannabi 
1,the number of death in the us due to ani caus increas by approxim   from march  to may   which is  higher than the report number of covid death offici talli of death due to covid underestim the full increas in death associ with the pandem 
1,rscienc stand with the pari climat agreement 
1,rebelli music genr such as rap punk and heavi metal do not appear to be link to maladapt person trait suggest new us studi n but conserv music such as countri and gospel were weakli link to trait that captur neurot hostil and eccentr tendenc 
1,analysi of trump tweet show he sleep less and get angrier 
1,recent studi in vaccin reveal that the major of antivaxx ad on facebook are fund by just two organ provaccin ad were fund by  
1, of the  peopl  who attend servic at a rural arkansa church march – test posit for the coronaviru ultim kill three 
1,research success dri vaccin into a film that is shelfstabl need no refriger dissolv in the mouth deliv the dose as effect as a shot and remain effect after  year 
1,the bacteria in our gut the human microbiom churn out ten of thousand of tini novel protein so small   amino acid they’v gone unnot until now they belong to over  new biolog famili and may explain how the microbiom affect human health pave the way for new drug 
1,vaccin fear brought measl back to new york parent who refus to vaccin their children foster the spread of a oncevanquish diseas between octob  and juli   peopl in nyc contract measl  of whom were hospit the outbreak cost at least us million 
1,it may be better to be born rich than gift  the leastgift children of highincom parent graduat from colleg at higher rate than the mostgift children of lowincom parent find a new studi in natur genet 
1,introvert can feel out of place within our western cultur that valu extravers a new studi found that introvert becom unhappi with themselv if they compar themselv to an extravert cultur ideal but if they accept their authent quiet selv they can flourish and be fulfil 
1,hint of life spot on venu research have found a possibl biomark on the planet cloud 
